{
  "schema_version": "1.0.0",
  "registry": "ecosystem/portfolio.json",
  "repository": "looloofy69-sketch/Ecosystems-loofy",
  "updated_at": "2026-10-25",
  "policy": {
    "production_claim_requires": [
      "a named deployed version or immutable source revision",
      "automated tests for the claimed interface",
      "a verified integration or smoke-test result",
      "security and privacy review for data and side-effect boundaries"
    ],
    "rule": "A repository, README, green build, design contract, or planned connection does not by itself establish runtime integration."
  },
  "components": [
    {
      "id": "ecosystems-loofy",
      "name": "Ecosystems Loofy control plane and decision module",
      "repository_url": "https://github.com/looloofy69-sketch/Ecosystems-loofy",
      "role": "Canonical portfolio map, integration contracts, governance, and internal decision-algorithm prototype.",
      "maturity": "prototype",
      "integration_state": "local-library",
      "production_endpoint": null,
      "dependencies": [],
      "interfaces": [
        "Python package: modules/decision-infrastructure",
        "Declarative workflow and portfolio CLI",
        "SQLite task-run ledger"
      ],
      "known_gaps": [
        "The portfolio map is a contract and inventory, not a deployed cross-system controller.",
        "The decision module is not yet exposed as a versioned EL-Rouji service or MCP tool.",
        "No production deployment, SLO, full security audit, or hard resource isolation is claimed."
      ],
      "evidence": [
        {
          "kind": "ci",
          "url": "https://github.com/looloofy69-sketch/Ecosystems-loofy/actions/runs/40133209274",
          "claim": "Repository validation and package test/build workflow passed; this does not prove production integration."
        },
        {
          "kind": "source",
          "url": "https://github.com/looloofy69-sketch/Ecosystems-loofy/tree/main/modules/decision-infrastructure",
          "claim": "Decision algorithms, workflow/portfolio controllers, examples, and tests are present."
        }
      ]
    },
    {
      "id": "el-rouji-core",
      "name": "EL-Rouji assistant application",
      "repository_url": "https://github.com/looloofy69-sketch/EL-Rouji",
      "role": "Primary multilingual assistant UI and hosted API.",
      "maturity": "deployed",
      "integration_state": "live-core",
      "production_endpoint": "https://el-rouji-70120b.v2.appdeploy.ai/",
      "dependencies": [],
      "interfaces": [
        "GET /api/health",
        "POST /api/chat",
        "POST /api/research",
        "POST /api/analyze-image",
        "POST /api/analyze-document",
        "GET /api/conversations",
        "PUT /api/conversations/:id",
        "DELETE /api/conversations/:id"
      ],
      "known_gaps": [
        "The most recent connected AppDeploy check reported ready status for snapshot 1792849620557 and no QA errors, but not every endpoint or user journey was independently exercised.",
        "The research route has no route-local requireAuth middleware in the inspected source; its intended public/private policy and server-enforced cost/rate limits require an explicit review.",
        "Direct page scraping is disabled in the inspected deployed source; query-based search still depends on a correctly configured server-side Tavily key.",
        "Full account isolation, retention/deletion, and production security verification remain release gates."
      ],
      "evidence": [
        {
          "kind": "deployment",
          "url": "https://el-rouji-70120b.v2.appdeploy.ai/",
          "claim": "Connected AppDeploy status reported ready at snapshot 1792849620557 on 2026-10-25; this is a platform status result, not an exhaustive end-to-end test."
        },
        {
          "kind": "ci",
          "url": "https://github.com/looloofy69-sketch/EL-Rouji/actions/runs/40099475237",
          "claim": "GitHub Actions CI run 94 passed."
        },
        {
          "kind": "source",
          "url": "https://github.com/looloofy69-sketch/EL-Rouji/blob/main/backend/index.ts",
          "claim": "Source of truth for current API handlers; compare with the deployed snapshot before release."
        }
      ]
    },
    {
      "id": "el-rouji-mcp-adapter",
      "name": "EL-Rouji MCP adapter",
      "repository_url": "https://github.com/looloofy69-sketch/Mcps-EL-Rouji-",
      "role": "Local MCP stdio adapter for selected EL-Rouji HTTP API endpoints.",
      "maturity": "implemented-unverified",
      "integration_state": "adapter-to-core",
      "production_endpoint": null,
      "dependencies": [
        "el-rouji-core"
      ],
      "interfaces": [
        "MCP over stdio",
        "el_rouji_health",
        "el_rouji_chat",
        "el_rouji_research",
        "el_rouji_analyze_text"
      ],
      "known_gaps": [
        "The configured upstream API calls and local CI are documented, but a live end-to-end MCP-to-deployed-API test was not found in inspected evidence.",
        "Generation-related tools are disabled by default and must remain opt-in until cost, privacy, and rate controls are verified.",
        "This adapter does not provide arbitrary local-file access, device control, scheduling, or commerce operations."
      ],
      "evidence": [
        {
          "kind": "ci",
          "url": "https://github.com/looloofy69-sketch/Mcps-EL-Rouji-/actions/runs/40097531696",
          "claim": "CI run 5 passed configuration and server-import checks."
        },
        {
          "kind": "source",
          "url": "https://github.com/looloofy69-sketch/Mcps-EL-Rouji-/blob/main/src/el_rouji_mcp/server.py",
          "claim": "The adapter exposes a bounded allow-list of upstream API calls."
        }
      ]
    },
    {
      "id": "el-rouji-commerce",
      "name": "EL-Rouji e-commerce specification",
      "repository_url": "https://github.com/looloofy69-sketch/E-commerce-EL-Rouji-",
      "role": "Commerce product requirements, draft API contracts, schemas, and proposed architecture.",
      "maturity": "specification-only",
      "integration_state": "contract-only",
      "production_endpoint": null,
      "dependencies": [
        "el-rouji-core"
      ],
      "interfaces": [
        "Draft product schema",
        "Draft checkout request and response schemas",
        "Draft error envelope"
      ],
      "known_gaps": [
        "No runnable storefront, commerce API, database, inventory service, payment adapter, or fulfillment integration is present at the inspected baseline.",
        "Market, currency, payment, shipping, tax, identity, return, and refund decisions remain open.",
        "Do not expose purchase, checkout, or payment tools in EL-Rouji until the commerce backend exists and is independently security-tested."
      ],
      "evidence": [
        {
          "kind": "ci",
          "url": "https://github.com/looloofy69-sketch/E-commerce-EL-Rouji-/actions/runs/40098775711",
          "claim": "Contract validation passed; this validates draft schemas and examples rather than live endpoints."
        },
        {
          "kind": "source",
          "url": "https://github.com/looloofy69-sketch/E-commerce-EL-Rouji-/blob/main/docs/ARCHITECTURE.md",
          "claim": "Architecture is explicitly a proposal."
        }
      ]
    },
    {
      "id": "el-rouji-jobs",
      "name": "EL-Rouji jobs design",
      "repository_url": "https://github.com/looloofy69-sketch/EL-Rouji-jobs",
      "role": "Requirements and architecture for future durable jobs and scheduling.",
      "maturity": "specification-only",
      "integration_state": "contract-only",
      "production_endpoint": null,
      "dependencies": [
        "el-rouji-core"
      ],
      "interfaces": [
        "Proposed job lifecycle",
        "Proposed owner-scoped job API",
        "Proposed bounded dispatcher and named handlers"
      ],
      "known_gaps": [
        "No queue, scheduler, worker, job API, cron configuration, or durable job store is implemented in this repository.",
        "A runtime choice and bounded due-job selection strategy require evidence before implementation.",
        "Do not advertise scheduled or autonomous future execution until a concrete handler and end-to-end tests exist."
      ],
      "evidence": [
        {
          "kind": "source",
          "url": "https://github.com/looloofy69-sketch/EL-Rouji-jobs/blob/main/docs/JOBS_DESIGN_SPEC.md",
          "claim": "The current document explicitly labels the subsystem not implemented."
        },
        {
          "kind": "source",
          "url": "https://github.com/looloofy69-sketch/EL-Rouji-jobs/blob/main/docs/ADR-001-APPDEPLOY-JOB-RUNTIME.md",
          "claim": "Candidate AppDeploy-native design is proposed, not approved or deployed."
        }
      ]
    },
    {
      "id": "el-rouji-datasets",
      "name": "EL-Rouji dataset governance",
      "repository_url": "https://github.com/looloofy69-sketch/EL-Rouji-datasetes",
      "role": "Dataset catalog, provenance/licensing policy, manifests, and validation templates.",
      "maturity": "specification-only",
      "integration_state": "contract-only",
      "production_endpoint": null,
      "dependencies": [
        "el-rouji-core"
      ],
      "interfaces": [
        "Dataset catalog",
        "Manifest template",
        "Proposed JSONL record schema",
        "Validation script and CI"
      ],
      "known_gaps": [
        "No production dataset artifact is present or verified as collected, licensed, approved, or released.",
        "No training pipeline or production evaluation consumer is connected to the core application.",
        "A dataset must not be used for training or redistribution solely because it is approved for evaluation."
      ],
      "evidence": [
        {
          "kind": "ci",